candidate_id,name,experience_years,matched_skills,missing_skills,relevance_score,skill_score,experience_score,final_score,explanation
C001,Aarav Mehta,4.0,"aws, machine learning, pandas, python, scikit-learn, sql, streamlit",data visualization,42.09,87.5,100.0,66.67,"Matches: aws, machine learning, pandas, python, scikit-learn, sql, streamlit. Experience: 4 years. Gaps: data visualization."
C002,Diya Shah,3.0,"data visualization, pandas, python, sql","aws, machine learning, scikit-learn, streamlit",16.59,50.0,100.0,40.79,"Matches: data visualization, pandas, python, sql. Experience: 3 years. Gaps: aws, machine learning, scikit-learn, streamlit."
C005,Kabir Singh,5.0,"data visualization, sql","aws, machine learning, pandas, python, scikit-learn, streamlit",13.36,25.0,100.0,30.43,"Matches: data visualization, sql. Experience: 5 years. Gaps: aws, machine learning, pandas, python, scikit-learn, streamlit."
C004,Meera Iyer,2.0,"machine learning, python","aws, data visualization, pandas, scikit-learn, sql, streamlit",11.86,25.0,66.67,24.68,"Matches: machine learning, python. Experience: 2 years. Gaps: aws, data visualization, pandas, scikit-learn, sql, streamlit."
C003,Rohan Kumar,4.0,,"aws, data visualization, machine learning, pandas, python, scikit-learn, sql, streamlit",0.0,0.0,100.0,15.0,"Matches: no explicitly detected job skills. Experience: 4 years. Gaps: aws, data visualization, machine learning, pandas, python, scikit-learn, sql, streamlit."
